{
  "workspaceId": "ws-cit",
  "date": "2026-03-31",
  "collectedAt": "2026-03-31T01:15:32Z",
  "controller": {
    "version": "none",
    "status": "unknown",
    "ciResult": "unknown"
  },
  "agent": {
    "version": "none",
    "status": "unknown",
    "ciResult": "unknown"
  },
  "totalAuditEntries": 28,
  "runsLast24h": 733,
  "failuresLast24h": 232,
  "frozen": false,
  "health": "degraded",
  "runId": "23775736514"
}
